{"$schema":"urn:techpub:schema:v1:artifact-record:frozen-2","artifactHash":"sha256:abd9b428864cd47bb28617c251d7504095add87b84388b4605fd80e421af9f48","artifactRef":"local-shadow://pdf-request-05cf88265253e63a.unified-package.json","byteLength":493111,"contentHash":"sha256:c2e4716fdde0ca6d29673d19ec21288d0030ac07a6d511081e7d857400897aa3","contractRevision":"frozen.2","mediaType":"application/json","packageId":"urn:techpub:package:v1:sha256:c2e4716fdde0ca6d29673d19ec21288d0030ac07a6d511081e7d857400897aa3","schemaVersion":"techpub.artifact-record.v1"}
