{"$schema":"urn:techpub:schema:v1:artifact-record:frozen-2","artifactHash":"sha256:305aff0102c82cfac5609d99ca47b2dd574a05d27b5a3ba889630a979fbfb2ec","artifactRef":"local-shadow://pdf-request-7b793ed00e10ae85.unified-package.json","byteLength":508172,"contentHash":"sha256:bd7d7f707b6ac6518d99de187c1f1295f70df5d12714d4eab000f6025cb354a2","contractRevision":"frozen.2","mediaType":"application/json","packageId":"urn:techpub:package:v1:sha256:bd7d7f707b6ac6518d99de187c1f1295f70df5d12714d4eab000f6025cb354a2","schemaVersion":"techpub.artifact-record.v1"}
