{"$schema":"urn:techpub:schema:v1:artifact-record:frozen-2","artifactHash":"sha256:84d37eda63352934a69f7b1b37c0e174b74c7274e47d9041513e990c5091e1ac","artifactRef":"local-shadow://pdf-request-add32c7d4192d35c.unified-package.json","byteLength":273349,"contentHash":"sha256:60c1b8548bf24a19d7d9f9cd3bc9fdafe252b034384aabcbba6d79517dc2972d","contractRevision":"frozen.2","mediaType":"application/json","packageId":"urn:techpub:package:v1:sha256:60c1b8548bf24a19d7d9f9cd3bc9fdafe252b034384aabcbba6d79517dc2972d","schemaVersion":"techpub.artifact-record.v1"}
