{"$schema":"urn:techpub:schema:v1:artifact-record:frozen-2","artifactHash":"sha256:349ef64d4538f77aeaf20796deea0e2c5ac2e7cb6d0b4df587570b32d09c56d2","artifactRef":"local-shadow://pdf-request-b1b5c198df4a3d42.unified-package.json","byteLength":662441,"contentHash":"sha256:9e734a0de1c37c368b954662e9bb11036cc24b430468a073b31da127380df622","contractRevision":"frozen.2","mediaType":"application/json","packageId":"urn:techpub:package:v1:sha256:9e734a0de1c37c368b954662e9bb11036cc24b430468a073b31da127380df622","schemaVersion":"techpub.artifact-record.v1"}
